{
  "additionalProperties": false,
  "properties": {
    "code": {
      "title": "Code",
      "type": "string"
    },
    "severity": {
      "title": "Severity",
      "type": "string"
    },
    "message": {
      "title": "Message",
      "type": "string"
    },
    "obligation_id": {
      "anyOf": [
        {
          "type": "string"
        },
        {
          "type": "null"
        }
      ],
      "default": null,
      "title": "Obligation Id"
    },
    "submission_id": {
      "anyOf": [
        {
          "type": "string"
        },
        {
          "type": "null"
        }
      ],
      "default": null,
      "title": "Submission Id"
    },
    "ledger_id": {
      "anyOf": [
        {
          "type": "string"
        },
        {
          "type": "null"
        }
      ],
      "default": null,
      "title": "Ledger Id"
    },
    "change_id": {
      "anyOf": [
        {
          "type": "string"
        },
        {
          "type": "null"
        }
      ],
      "default": null,
      "title": "Change Id"
    },
    "path": {
      "anyOf": [
        {
          "type": "string"
        },
        {
          "type": "null"
        }
      ],
      "default": null,
      "title": "Path"
    },
    "suggested_action": {
      "anyOf": [
        {
          "type": "string"
        },
        {
          "type": "null"
        }
      ],
      "default": null,
      "title": "Suggested Action"
    }
  },
  "required": [
    "code",
    "severity",
    "message"
  ],
  "title": "AdminFinding",
  "type": "object",
  "$schema": "https://json-schema.org/draft/2020-12/schema"
}
